{
  "id": "7d8e9f0a-1b2c-4d3e-5f6a-7b8c9d0e1f2a",
  "user_id": "f7e8d9c0-b1a2-4536-9d8e-7f6a5b4c3d2e",
  "workshop_id": "8a9b0c1d-2e3f-4a5b-6c7d-8e9f0a1b2c3d",
  "status": "echange",
  "payment_status": "paid",
  "ticket_type": "pro",
  "price_paid": 120.00,
  "can_refund": false,
  "exchange_parent_participation_id": "2b3c4d5e-6f7a-4b8c-9d0e-1f2a3b4c5d6e",
  "invoice_url": "https://storage.1er-degre.fr/invoices/INV-2025-1156.pdf",
  "confirmation_date": "2025-10-08T09:15:00Z",
  "mail_disabled": false,
  "training_completion": null,
  "attended": null,
  "questionnaire_response_id": null,
  "tenant_id": "1er-Degr√©",
  "created_at": "2025-10-08T09:12:00Z",
  "updated_at": "2025-10-08T09:15:00Z"
}
