{
  "id": "5c6d7e8f-9a0b-4c1d-2e3f-4a5b6c7d8e9f",
  "user_id": "a1b2c3d4-e5f6-4a7b-8c9d-0e1f2a3b4c5d",
  "workshop_id": "3f4e5d6c-7b8a-4c9d-0e1f-2a3b4c5d6e7f",
  "status": "paye",
  "payment_status": "paid",
  "ticket_type": "normal",
  "price_paid": 45.00,
  "can_refund": true,
  "exchange_parent_participation_id": null,
  "invoice_url": "https://storage.1er-degre.fr/invoices/INV-2025-1042.pdf",
  "confirmation_date": "2025-10-01T14:22:00Z",
  "mail_disabled": false,
  "training_completion": {
    "completed": true,
    "completion_date": "2025-11-15T17:30:00Z",
    "certificate_url": "https://storage.1er-degre.fr/certificates/CERT-2025-1042.pdf"
  },
  "attended": true,
  "questionnaire_response_id": "9e8f7d6c-5b4a-3c2d-1e0f-9a8b7c6d5e4f",
  "tenant_id": "1er-Degr√©",
  "created_at": "2025-10-01T14:20:00Z",
  "updated_at": "2025-11-15T17:30:00Z"
}
